{
  "checks": [
    {
      "findings": 1,
      "kind": "advisory",
      "status": "fail"
    },
    {
      "deniedFindings": 1,
      "kind": "license",
      "status": "fail"
    }
  ],
  "reports": [
    {
      "root": "app==1.0.0",
      "schema": "edgp.graph.snapshot.v1",
      "summary": {
        "edges": 2,
        "nodes": 3
      }
    },
    {
      "root": "demo-app==1.0.0",
      "schema": "edgp.advisory.report.v1",
      "summary": {
        "advisories": 1,
        "affectedDependents": 2,
        "findings": 1,
        "matchedPackages": 1
      }
    },
    {
      "root": "demo-app==1.0.0",
      "schema": "edgp.license.report.v1",
      "summary": {
        "deniedFindings": 1,
        "distinctLicenses": 1,
        "licensedPackages": 1,
        "missingLicenses": 1,
        "packages": 2
      }
    },
    {
      "root": "conflict-app==1.0.0",
      "schema": "edgp.npm.diagnostics.v1",
      "summary": {
        "duplicatePackageNames": 1,
        "nestedResolutionConflicts": 1,
        "packages": 4,
        "unresolvedDependencies": 1
      }
    }
  ],
  "schema": "edgp.triage.summary.v1",
  "source": {
    "kind": "report-list",
    "reports": 4
  },
  "status": "fail",
  "summary": {
    "advisoryFindings": 1,
    "advisoryReports": 1,
    "bundleCatalogReports": 0,
    "catalogBundles": 0,
    "catalogFailedBundles": 0,
    "catalogFailures": 0,
    "catalogTriageFail": 0,
    "catalogTriageWarn": 0,
    "deniedLicenseFindings": 1,
    "diffTreeEdgeChurn": 0,
    "diffTreeNetEdgeDelta": 0,
    "diffTreeNetNodeDelta": 0,
    "diffTreeNodeChurn": 0,
    "diffTreePolicyFailures": 0,
    "diffTreeReports": 0,
    "edges": 2,
    "failedChecks": 2,
    "graphDiffPolicyFailures": 0,
    "graphDiffReports": 0,
    "graphSnapshots": 1,
    "impactReports": 0,
    "licenseReports": 1,
    "missingLicenses": 1,
    "nodes": 3,
    "npmDiagnosticsReports": 1,
    "npmDuplicatePackageNames": 1,
    "npmNestedResolutionConflicts": 1,
    "npmUnresolvedDependencies": 1,
    "reports": 4
  },
  "topFindings": {
    "advisories": [
      {
        "id": "ADV-LOCAL-0001",
        "package": "left-pad==1.3.0",
        "severity": "high",
        "summary": "Demo advisory for validating local dependency impact reports."
      }
    ],
    "bundleCatalog": [],
    "graphDiffPolicies": [],
    "diffTreePolicies": [],
    "licenses": [
      {
        "license": "WTFPL",
        "matchedDeniedLicenses": ["WTFPL"],
        "package": "left-pad==1.3.0"
      }
    ],
    "npm": [
      {
        "count": 1,
        "kind": "duplicatePackageNames",
        "root": "conflict-app==1.0.0"
      },
      {
        "count": 1,
        "kind": "nestedResolutionConflicts",
        "root": "conflict-app==1.0.0"
      },
      {
        "count": 1,
        "kind": "unresolvedDependencies",
        "root": "conflict-app==1.0.0"
      }
    ]
  }
}
